{
  "@id": null,
  "@context": {
    "rdfs": "http://www.w3.org/2000/01/rdf-schema#",
    "xsd": "http://www.w3.org/2001/XMLSchema#",
    "pav": "http://purl.org/pav/",
    "schema": "http://schema.org/",
    "oslc": "http://open-services.net/ns/core#",
    "skos": "http://www.w3.org/2004/02/skos/core#",
    "rdfs:label": {
      "@type": "xsd:string"
    },
    "schema:isBasedOn": {
      "@type": "@id"
    },
    "schema:name": {
      "@type": "xsd:string"
    },
    "schema:description": {
      "@type": "xsd:string"
    },
    "pav:createdOn": {
      "@type": "xsd:dateTime"
    },
    "pav:createdBy": {
      "@type": "@id"
    },
    "pav:lastUpdatedOn": {
      "@type": "xsd:dateTime"
    },
    "oslc:modifiedBy": {
      "@type": "@id"
    },
    "skos:notation": {
      "@type": "xsd:string"
    }
  },
  "schema:isBasedOn": "https://repo.metadatacenter.orgx/templates/ba9844b0-5b12-4a54-ab4e-94261f10ffae",
  "schema:name": "Single Field Template metadata",
  "schema:description": "",
  "pav:createdOn": "2018-11-12T16:37:43-0800",
  "pav:createdBy": "https://metadatacenter.org/users/018bbf94-f8e4-4e0e-946d-341698f70245",
  "pav:lastUpdatedOn": "2018-11-12T16:37:43-0800",
  "oslc:modifiedBy": "https://metadatacenter.org/users/018bbf94-f8e4-4e0e-946d-341698f70245"
}